{
  "schema_version": "1.0.0",
  "slice_id": "slice-005",
  "review_date": "2026-04-12",
  "verdict": "approved",
  "summary": "Plan cobre todos os 5 ACs com tasks concretas, decisões arquiteturais alinhadas ao spec e ADR-0001, riscos do spec endereçados com mitigações acionáveis, sem pacotes externos adicionados e sem abstrações prematuras.",
  "checks": {
    "ac_coverage": {
      "status": "pass",
      "details": "Todos os 5 ACs (AC-001 a AC-005) têm pelo menos 1 task mapeada. Mapeamento AC→arquivos está completo na tabela do plan. TASK-004 cobre 4 cenários de teste para 5 ACs (AC-004 é meta-teste sobre os demais). Nenhuma task referencia AC inexistente."
    },
    "architectural_decisions": {
      "status": "pass",
      "details": "5 decisões (D1-D5) com 3 alternativas cada, justificativa concreta, reversibilidade declarada. D1, D4 e D5 referenciam explicitamente requisitos do spec. Nenhuma contradição com ADR-0001 (Laravel + PG + Redis) nem com constitution P1-P9/R1-R12. Nenhuma decisão inventa requisito fora do spec."
    },
    "technical_feasibility": {
      "status": "pass",
      "details": "Tasks são concretas com arquivo-alvo, código orientador e checklist de validação. Dependências entre tasks seguem ordem lógica (controller → middleware → rota → testes). Todas as primitivas usadas (DB facade, Redis facade, Cache::store array, response()->json) são nativas do Laravel 13 conforme ADR-0001. Nenhum pacote externo adicionado."
    },
    "risks_mitigations": {
      "status": "pass",
      "details": "2 riscos do spec endereçados: (1) exception não capturada → try/catch em D2/D3 + risco Throwable na tabela, (2) dependência circular Redis → D4 driver array. 3 riscos adicionais com mitigações concretas (PHPStan catch syntax, middleware stack interference, mock cleanup). Nenhum risco vago tipo 'monitorar' ou 'avaliar depois'."
    },
    "security": {
      "status": "pass",
      "details": "Endpoint público sem auth — consistente com spec (fora de escopo explícito). Rate limiting via middleware dedicado protege contra flood. Nenhum dado sensível exposto (apenas strings de status e timestamp). Nenhum vetor de ataque introduzido."
    },
    "simplicity": {
      "status": "pass",
      "details": "Solução mínima: 1 controller invocável, 1 middleware, 1 arquivo de teste, 1 linha de rota. Zero pacotes adicionados. Nenhuma abstração prematura (sem factory, strategy, service layer). Código orientador do TASK-001 tem ~30 linhas — proporcional ao escopo."
    }
  },
  "findings": [],
  "stats": {
    "total_checks": 6,
    "passed": 6,
    "failed": 0,
    "findings_critical": 0,
    "findings_major": 0,
    "findings_minor": 0
  }
}
