{
  "schema_version": "1.0.0",
  "slice_id": "slice-006",
  "review_date": "2026-04-13",
  "verdict": "approved",
  "summary": "O plano cobre todos os ACs do slice 006, mantém aderência à ADR-0001 e usa a base mais simples para validar frontend, rota técnica e build de assets. Não encontrei conflitos materiais de cobertura, segurança ou viabilidade.",
  "checks": {
    "ac_coverage": {
      "status": "pass",
      "details": "Todos os ACs do spec têm mapeamento explícito no plan.md, com arquivos-alvo e teste principal em tests/slice-006/FrontendBaseTest.php."
    },
    "architectural_decisions": {
      "status": "pass",
      "details": "As decisões D1-D5 apresentam alternativas, justificativa e reversibilidade; estão alinhadas com a ADR-0001 e não contradizem a constitution."
    },
    "technical_feasibility": {
      "status": "pass",
      "details": "As mudanças são concretas, com arquivos específicos para Composer, Vite, Blade, Livewire, rota e suíte de testes. O escopo é compatível com um slice único."
    },
    "risks_mitigations": {
      "status": "pass",
      "details": "Os riscos principais estão tratados com mitigação concreta: Tailwind CSS 4 no modo CSS-first, Alpine sem duplicação, rota /ping restrita fora de production e validação de manifest com hash."
    },
    "security": {
      "status": "pass",
      "details": "A rota técnica permanece fora de production e o plano não expõe estado interno, stack trace ou diagnóstico público em ambiente produtivo."
    },
    "simplicity": {
      "status": "pass",
      "details": "O plano evita abstrações prematuras, não adiciona pacote sem justificativa visível e concentra a verificação em uma suíte de slice simples."
    }
  },
  "findings": [],
  "stats": {
    "total_checks": 6,
    "passed": 6,
    "failed": 0,
    "findings_critical": 0,
    "findings_major": 0,
    "findings_minor": 0
  }
}
