{
  "schema_version": "1.0.0",
  "slice_id": "slice-007",
  "review_date": "2026-04-13",
  "verdict": "approved",
  "summary": "Plano alinhado à spec, constitution e ADRs vigentes. A cobertura de ACs, riscos, segurança e simplicidade está completa e coerente com o escopo do slice.",
  "checks": {
    "ac_coverage": {
      "status": "pass",
      "details": "Todos os ACs 001-021 têm ao menos uma task e um arquivo principal mapeado no plan, sem lacunas relevantes de cobertura."
    },
    "architectural_decisions": {
      "status": "pass",
      "details": "As decisões listam alternativas, justificativa e reversibilidade, e permanecem alinhadas às ADRs vigentes e à constitution."
    },
    "technical_feasibility": {
      "status": "pass",
      "details": "As tasks são concretas, com arquivos e entregas específicas, e a ordem de execução preserva as dependências do slice."
    },
    "risks_mitigations": {
      "status": "pass",
      "details": "Os riscos conhecidos do spec aparecem no plan com mitigações concretas e verificáveis."
    },
    "security": {
      "status": "pass",
      "details": "O plan considera autenticação, bloqueios de acesso, rate limit, auditoria e sanitização de payload sem introduzir vetores óbvios."
    },
    "simplicity": {
      "status": "pass",
      "details": "A solução permanece no menor escopo coerente com os ACs e não adiciona abstrações ou pacotes desnecessários para este slice."
    }
  },
  "findings": [],
  "stats": {
    "total_checks": 6,
    "passed": 6,
    "failed": 0,
    "findings_critical": 0,
    "findings_major": 0,
    "findings_minor": 0
  }
}
