{
  "schema_version": "1.0.0",
  "slice_id": "slice-008",
  "review_date": "2026-04-14",
  "verdict": "approved",
  "summary": "O plano cobre todos os ACs do spec, mantem o escopo em TEN-001 e lista decisoes, arquivos, riscos e comandos suficientes para implementar o primeiro laboratorio isolado sem expandir para usuarios, planos ou LGPD.",
  "checks": {
    "ac_coverage": {
      "status": "pass",
      "details": "O mapeamento cobre AC-001 a AC-012 e tambem inclui os criterios AC-SEC-001 a AC-SEC-003, com testes principais separados por pagina, validacao, isolamento e auditoria."
    },
    "architectural_decisions": {
      "status": "pass",
      "details": "As seis decisoes apresentam alternativas, escolha, razao, reversibilidade e aderencia aos ADRs vigentes, sem exigir ADR novo ou pacote externo."
    },
    "technical_feasibility": {
      "status": "pass",
      "details": "As tasks indicam arquivos concretos, ordem de execucao, modelos, migrations, servicos, pagina Livewire e testes focados. O plano usa a stack ja aceita e aproveita o slice 007 como dependencia."
    },
    "risks_mitigations": {
      "status": "pass",
      "details": "Os riscos do spec estao mitigados por transacao, revalidacao de papel e vinculo, bloqueio de modo somente leitura, rejeicao de IDs externos, mensagens neutras e auditoria sanitizada."
    },
    "security": {
      "status": "pass",
      "details": "O plano considera autenticacao, 2FA concluido, papel gerente, tenant atual, modo somente leitura, isolamento via RLS nas novas tabelas escopadas e ausencia de segredo na auditoria."
    },
    "simplicity": {
      "status": "pass",
      "details": "A solucao evita onboarding publico, integracao externa de CNPJ e RBAC completo. As classes novas existem para fronteiras reais do slice: tenant atual, atualizacao transacional, auditoria e validacao de CNPJ."
    }
  },
  "findings": [],
  "stats": {
    "total_checks": 6,
    "passed": 6,
    "failed": 0,
    "findings_critical": 0,
    "findings_major": 0,
    "findings_minor": 0
  }
}
